QuestionID,Domain Tags,Question,Manually Reviewed,Search Tags,Answer (1),Answer (2),Answer (3),Answer (4),Employer Question Phrasing,Employer Answer 1,Employer Answer 2,Employer Answer 3,Employer Answer 4
67,Technical Knowledge,Describe your experience with handling and managing Big Data solutions.,TRUE,"Big Data, Handling, Management, Experience",No experience,"Beginner: Understands the concept of Big Data, familiar with basic Big Data tools and platforms.","Intermediate: Has experience in managing Big Data solutions in a professional setting, capable of setting up and maintaining Big Data platforms.","Advanced: Extensive experience in managing complex Big Data solutions, able to design and implement Big Data strategies and architectures.",,,,,
68,Technical Knowledge,Rate your understanding of the Secure Development Lifecycle (SDL) based on your experience.,TRUE,"SDL, Secure Development, Lifecycle, Understanding Level",No experience,"Beginner: Familiar with the concept of SDL, understands the importance of security in the development process.","Intermediate: Experience in implementing SDL in a professional setting, able to incorporate security practices into development workflows.","Advanced: Extensive experience in SDL, able to design and implement secure development strategies, proficient in various security tools and techniques.",,,,,
69,Technical Knowledge,How proficient are you with functional programming concepts and their application?,TRUE,"Functional Programming, Concepts, Application, Proficiency Level",No experience,"Beginner: Understands the basics of functional programming, has written simple functional code.","Intermediate: Has professional experience with functional programming, able to write complex functional code and apply functional programming concepts.","Advanced: Extensive professional experience with functional programming, able to apply functional programming concepts to complex software projects",,,,,
70,Technical Knowledge,Describe your experience with responsive design and cross-platform compatibility in web development.,TRUE,"Responsive Design, Cross-Platform Compatibility, Web Development, Experience",No experience,"Beginner: Familiar with the concepts of responsive design and cross-platform compatibility, able to design simple responsive web pages.","Intermediate: Has professional experience with responsive web design and cross-platform development, able to create complex responsive web designs and ensure cross-platform compatibility.","Advanced: Extensive professional experience with responsive design and cross-platform compatibility, able to design and implement complex responsive designs and ensure cross-platform compatibility for large-scale projects.",,,,,
71,Sales & Marketing Skills,What is your experience level in creating and delivering product demonstrations?,TRUE,"Product Demonstrations, Presentation Skills, Customer Engagement",No experience,Beginner: I have created and delivered product demonstrations a few times.,Intermediate: I regularly create and deliver product demonstrations.,Advanced: I have extensive experience creating and delivering product demonstrations in a variety of settings.,,,,,
72,Sales & Marketing Skills,How proficient are you in collaborating with technical teams to design solutions that fulfill customer needs?,TRUE,"Technical Teams, Collaboration, Solution Design",No experience,Beginner: I have collaborated with technical teams on a few occasions to design solutions.,Intermediate: I often collaborate with technical teams to design solutions.,Advanced: Collaborating with technical teams to design solutions is a significant part of my role.,,,,,
73,Sales & Marketing Skills,How would you assess your proposal writing and bid management skills?,TRUE,"Proposal Writing, Bid Management, Business Writing",No experience,Beginner: I have helped in proposal writing or bid management a few times.,Intermediate: I regularly engage in proposal writing or bid management.,"Advanced: I have extensive experience in proposal writing and bid management, often leading the process.",,,,,
74,Sales & Marketing Skills,How often did you engage in the proposal writing process in your previous roles?,TRUE,"Proposal Writing, Business Communication, Experience Level",No experience,Occasionally: I have occasionally participated in proposal writing processes.,Regularly: Participating in proposal writing processes has been a regular part of my previous roles.,"Always: I always participate in proposal writing processes, it is a central aspect of my role.",,,,,
75,Sales & Marketing Skills,"Based on your experience, how skilled are you in leading sales presentations to diverse stakeholders?",TRUE,"Proposal Writing, Business Communication, Experience Level",No experience,Beginner: I have led a few sales presentations.,Intermediate: I often lead sales presentations in my role.,"Advanced: I frequently lead sales presentations to a diverse set of stakeholders, including C-level executives.",,,,,
76,Sales & Marketing Skills,How would you rate your ability to manage security reviews during procurement stages?,TRUE," Security Reviews, Procurement Cycle, Risk Management",No experience ,Beginner: I have some experience managing security reviews during procurement cycles.,Intermediate: I regularly handle security reviews during procurement cycles.,Advanced: Handling security reviews during procurement cycles is a key part of my responsibilities.,,,,,
77,Sales & Marketing Skills,What is your proficiency level in supporting Proof of Concept (POC) or trial processes for customers?,TRUE,"Proof of Concept (POC), Client Support, Trial Process",No experience,Beginner: I have occasionally supported POC or trial processes for clients.,Intermediate: I frequently support POC or trial processes for clients.,Advanced: I regularly support POC or trial processes for clients and can manage them independently.,,,,,
78,Sales & Marketing Skills,How skilled are you in developing Request for Proposal (RFP) responses?,TRUE,"Request for Proposal (RFP), Business Writing, Response Management",No experience,Beginner: I have prepared a few RFP responses under supervision.,Intermediate: I have prepared numerous RFP responses independently.,Advanced: I routinely prepare RFP responses and have established a systematic approach to doing so.,,,,,
79,Sales & Marketing Skills,"Based on your experience, how proficient are you in demonstrating a product's technical capabilities to meet client needs during pre-sales calls?",TRUE,"Pre-sales, Technical Demonstrations, Client Requirements",No experience,Beginner: I have occasionally demonstrated a product's technical capabilities during pre-sales calls.,Intermediate: Independently conducted product demonstrations for small to medium-sized deals during pre-sales calls,Advanced: Led comprehensive product demonstrations during pre-sales calls for large-scale deals with complex client requirements. ,,,,,
80,Sales & Marketing Skills,How proficient are you in creating and delivering technical presentations to clients during the sales process?,TRUE,"Technical Presentations, Client Engagement, Sales Process",No experience,Beginner: Assisted in developing and delivering technical presentations under supervision,Intermediate: Independently developed and delivered technical presentations for small to medium-sized deals,"Advanced: Led the development and delivery of technical presentations for large-scale deals, tailoring content to client needs and concerns",,,,,
81,Sales & Marketing Skills,"Based on your experience, how well do you navigate the state and federal government procurement process in a pre-sales SE role?",TRUE,"Compliance, Regulatory Requirements, Government Contracts",No experience,"Beginner: Basic understanding, but have not directly handled a government deal",Intermediate: Have assisted or handled parts of the procurement process for government deals,"Advanced : Have independently managed the procurement process for large-scale government deals, handling complex requirements and scenarios",,,,,
82,Sales & Marketing Skills,How proficient are you in managing compliance and regulatory requirements specific to state and federal government contracts?,TRUE,"Government Standards, Proposal Delivery, Presentation Skills",No experience,"Beginner: basic understanding, but have not directly managed compliance in deals",Intermediate: Have assisted or handled parts of compliance and regulatory requirements for government deals,Advanced - Have independently managed complex compliance and regulatory requirements for large-scale government deals,,,,,
83,Sales & Marketing Skills,How would you rate your skills in delivering presentations and proposals that adhere to government standards and formats?,TRUE,"Government Standards, Proposal Delivery, Presentation Skills",No experience,Beginner: I have delivered a few presentations or proposals compliant with government standards and formats.,Intermediate: I regularly deliver presentations and proposals compliant with government standards and formats.,Advanced: Delivering presentations and proposals compliant with government standards and formats is/ was a key part of my role.,,,,,
84,Sales & Marketing Skills,What is your experience in presenting competitive differentiators to internal sales teams?,TRUE,"Training, Product Features, Sales Team",No experience,"Beginner: I've participated in, but not led, such presentations","Intermediate: I've led a few of these presentations, with guidance",Advanced: I regularly lead these presentations independently and am comfortable doing so.,,,,,
85,Sales & Marketing Skills,What is your experience level with leading product feature trainings for sales teams?,TRUE,"Product Management, Collaboration, Experience Level",No experience,"Beginner: I've participated in, but not led, such trainings",Intermediate: I regularly lead training on specific product features for sales teams.,Advanced Leading training on specific product features for sales teams is/ was a key part of my role.,,,,,
86,Sales & Marketing Skills,How frequently did you collaborate with Product Management teams in your previous roles?,TRUE,"Product Management, Collaboration, Experience Level",No experience,Beginner: I have collaborated with Product Management teams on a few occasions.,Intermediate: I often collaborate with Product Management to communicate customer needs and assist in roadmap planning.,"Advanced: I have a strong partnership with Product Management, regularly influencing product strategy based on customer insights.",,,,,
87,Sales & Marketing Skills,What is your experience in working with an internal sales team?,TRUE,"Internal Sales Team, Collaboration, Experience Level",No exposure to sales teams. ,Beginner: I have collaborated with an internal sales team on a few deals / projects. ,Intermediate: I regularly collaborate with an internal sales team.,"Advanced: I have a strong track record of partnering with sales teams, contributing to strategy, and playing a key role in winning deals.",,,,,
88,Sales & Marketing Skills,What has been the average deal size you worked on in your previous roles?,TRUE,"Deal Size, Sales Experience, Past Roles",No experience: I have not supported deals in my past roles.,Beginner: I have worked on small deals (less than $50k).,Intermediate: I have worked on mid-sized deals ($50k-$200k).,Advanced: I have worked on large deals ($200k+).,,,,,
89,Sales & Marketing Skills,What size of customer (employee count) are you most accustomed to dealing with in your sales engineering roles?,TRUE,"Customer Size, Sales Engineering, Experience Level",No experience: I have not worked with customers in a sales engineering role.,Beginner: I have worked with small businesses (less than 50 employees).,Intermediate: I have worked with mid-sized businesses (50-500 employees).,Advanced: I have worked with large enterprises (500+ employees).,,,,,
90,Tools & Platforms,How proficient are you with Salesforce CRM?,TRUE,"Salesforce CRM, Customer Relationship Management, Proficiency",No experience,"Beginner: I have limited experience with Salesforce CRM. I've used it in some capacity, but not extensively.",Intermediate: I've used Salesforce CRM regularly and I'm comfortable with its basic features and functionalities.,Advanced: I've used Salesforce CRM extensively. I'm familiar with advanced features and have applied it to solve complex tasks.,,,,,
91,Tools & Platforms,What is your proficiency level in using PowerPoint for sales presentations?,TRUE,"PowerPoint, Sales Presentations, Proficiency Level",No experience,"Beginner: I have created a few sales presentations using PowerPoint, but need further practice.",Intermediate: I've regularly created sales presentations using PowerPoint and I'm comfortable with its basic functionalities.,"Advanced: I have extensive experience creating sales presentations using PowerPoint, including using advanced features.",,,,,
92,Tools & Platforms,How proficient are you with Zoom or comparable platforms for sales meetings and demos?,TRUE,"Zoom, Sales Meetings, Demonstrations, Virtual Communication",No experience,Beginner: I have used Zoom or similar platforms a few times for sales meetings and demos.,Intermediate: I've regularly used Zoom or similar platforms for sales meetings and demos and am comfortable with its basic functionalities.,"Advanced: I have extensive experience with Zoom or similar platforms for sales meetings and demos, including hosting and managing meetings.",,,,,
93,Tools & Platforms,What is your experience with proposal and contract management platforms like PandaDoc?,TRUE,"Proposal Management, Contract Management, PandaDoc, Experience",No experience,"Beginner: I've used PandaDoc or similar platforms for basic tasks, like sending and tracking documents.","Inetermidiate: I'm comfortable with using PandaDoc, including creating and customizing proposal templates and managing contracts.","I'm proficient in PandaDoc, including automating document workflows and integrating with other tools.",,,,,
94,Tools & Platforms,"How comfortable are you working with standard G Suite tools (Google Docs, Sheets, Slides)?",TRUE,"G Suite, Google Docs, Google Sheets, Google Slides, Proficiency",No experience,"Beginner: I have some experience with G Suite tools, including creating and editing documents, but my experience is limited.","Intermediate: I've regularly used G Suite tools for various tasks, such as creating reports and presentations, and I'm comfortable with the main functionalities.","Advanced: I have extensive experience with G Suite tools, including using advanced features like scripting in Google Sheets and collaborative features in Docs and Slides.",,,,,
95,Tools & Platforms,What is your experience level with Microsoft Teams for internal collaboration?,TRUE,"Microsoft Teams, Collaboration, Proficiency Level",No experience,"Beginner: I have some experience with Microsoft Teams, mainly for participating in meetings or chats.","Intermediate: I've regularly used Microsoft Teams for a variety of collaboration tasks, including file sharing, meeting organization, and team chats.","Advanced: I have extensive experience with Microsoft Teams, including managing teams, setting permissions, and utilizing integrations for increased productivity.",,,,,
96,Tools & Platforms,"How proficient are you with Slack for team communication and collaboration?""",TRUE,"Slack, Team Communication, Collaboration, Proficiency",I haven't used Slack before.,"Beginner: I have some experience with Slack, primarily for direct communication or participating in channel discussions.","Intermediate: I've regularly used Slack for team communication, including using features like channels, direct messages, and file sharing.","Advanced: I have extensive experience with Slack, including setting up integrations, managing channels, and using advanced features for team collaboration.",,,,,
97,Tools & Platforms,What is your experience with project management tools like Jira or Trello?,TRUE,"Project Management, Jira, Trello, Experience",No experience,"Beginner: I have used project management tools like Jira or Trello for basic tasks, such as tracking task completion.","Intermediate: I've regularly used project management tools like Jira or Trello, including setting up and managing tasks, monitoring progress, and collaborating with team members.","Advanced: I have extensive experience with project management tools like Jira or Trello, including setting up complex projects, tracking and managing workflows, and utilizing advanced features and integrations.",,,,,
98,Tools & Platforms,How proficient are you with Tableau?,TRUE,"Tableau, Data Visualization, Proficiency",I haven't used Tableau before.,"Beginner: I have used Tableau for basic tasks, such as creating simple charts and visualizations.","Intermediate: I've regularly used Tableau, including creating dashboards, interactive visualizations, and using basic features for data analytics.","Advanced: I have extensive experience with Tableau, including data integration, advanced data analysis, creating complex interactive dashboards, and utilizing scripting for more complex tasks.",,,,,
99,Tools & Platforms,What is your experience with ZoomInfo for lead generation?,TRUE,"ZoomInfo, Lead Generation, Experience",I haven't used ZoomInfo before.,"Beginner: I have used ZoomInfo for basic tasks, primarily for looking up contacts or companies.","Intermediate: I've regularly used ZoomInfo, including for targeted lead generation and list building, and have used some of the advanced search features.","Advanced: I have extensive experience with ZoomInfo, including setting up and managing campaigns for lead generation, tracking and analyzing campaign results, and utilizing advanced features for targeted marketing.",,,,,
100,Tools & Platforms,What's your proficiency level with GitHub for version control and code collaboration?,TRUE,"GitHub, Version Control, Code Collaboration, Proficiency Level",I haven't used GitHub before.,"Beginner: I have used GitHub for basic tasks, such as cloning repositories and making commits.","Intermediate: I've regularly used GitHub, including managing branches, handling merges, and addressing merge conflicts.","Advanced: I have extensive experience with GitHub, including managing large repositories, handling complex merges, setting up continuous integration/continuous deployment (CI/CD) workflows, and other advanced features.",,,,,
101,Tools & Platforms,How proficient are you with HubSpot for marketing automation?,TRUE,"HubSpot, Marketing Automation, Proficiency",I haven't used HubSpot before.,"Beginner: I have used HubSpot for basic tasks, such as email marketing and CRM management.","Intermediate: I've regularly used HubSpot, including managing marketing campaigns, segmenting audiences, analyzing results, and some automation.","Advanced: I have extensive experience with HubSpot, including setting up and managing automated marketing campaigns, utilizing advanced analysis features, and integrating with other systems.",,,,,
102,Tools & Platforms,How familiar are you with LinkedIn for lead generation and networking?,TRUE,"LinkedIn, Lead Generation, Networking, Familiarity",I haven't used LinkedIn for lead generation or networking.,"Beginner: I have used LinkedIn for networking and to a lesser extent, lead generation, like sending connection requests and messages.","Intermediate: I've regularly used LinkedIn for lead generation and networking,","Advanced: I have extensive experience with LinkedIn, including optimizing profiles for visibility, running LinkedIn ad campaigns, leveraging LinkedIn's Sales Navigator for advanced lead generation, and building a substantial network.",,,,,
103,Tools & Platforms,What's your experience with Azure as a cloud computing service?,TRUE,"Azure, Cloud Computing, Experience",I haven't used Azure before. ,"Beginner: I have used Azure for basic tasks, such as setting up virtual machines or using simple Azure services.","Intermediate: I've regularly used Azure, including setting up and managing different services, implementing security measures, and handling basic troubleshooting.","Advanced: I have extensive experience with Azure, including architecting and managing complex service deployments, implementing advanced security measures, automation, and optimizing for cost and performance.",,,,,
104,Tools & Platforms,What is your proficiency level with Snowflake BI for data warehousing and analysis?,TRUE,"Snowflake BI, Data Warehousing, Data Analysis, Proficiency Level",I haven't used Snowflake BI before.,"Beginner: I have used Snowflake for basic tasks, such as setting up databases and running simple queries.","Intermediate: I've regularly used Snowflake, including setting up and managing data warehouses, creating and optimizing queries, and handling basic data analysis tasks.","Advanced: I have extensive experience with Snowflake, including managing large data warehouses, implementing data security measures, complex data analysis, and optimizing queries for performance.",,,,,
105,Tools & Platforms,How comfortable are you with Virtualization tools like VMware or Hyper-V?,TRUE,"Virtualization Tools, VMware, Hyper-V, Proficiency",I have no experience with virtualization tools like VMware or Hyper-V.,"Beginner: I have used virtualization tools like VMware or Hyper-V for basic tasks, such as setting up and running virtual machines.","Intermediate: I've regularly used virtualization tools, including managing multiple virtual machines, setting up virtual networks, and handling basic troubleshooting.","Advanced: I have extensive experience with virtualization tools, including managing large-scale virtual environments, implementing advanced network configurations, and optimizing for performance and security.",,,,,
106,Tools & Platforms,What's your experience level with HCM tools like Workday or SAP SuccessFactors?,TRUE,"Tags: HCM Tools, Workday, SAP SuccessFactors, Experience Level",I haven't used HCM tools before.,"Beginner: I have used HCM tools for basic tasks, such as employee onboarding, basic report generation, and data entry.","Intermediate: I've regularly used HCM tools, including handling personnel data, managing employee lifecycle events, and generating detailed reports.","Advanced: I have extensive experience with HCM tools, including managing complex HR processes, integrating with other systems, customizing workflows, and ensuring compliance with HR regulations.",,,,,
107,Tools & Platforms,How proficient are you with event management tools like Cvent or Eventbrite?,TRUE,"Event Management Tools, Cvent, Eventbrite, Proficiency",I haven't used Event Management tools before.,"Beginner: I have used Event Management tools for basic tasks, such as creating an event and managing registrations.","Intermediate: I've regularly used Event Management tools, including setting up complex event schedules, managing ticketing and payment systems, and promoting events.","dvanced: I have extensive experience with Event Management tools, including managing large-scale events, integrating with other systems for event promotion and data analysis, and customizing event experiences.",,,,,
108,Tools & Platforms,What's your experience with Auth0 for identity management?,TRUE,"Auth0, Identity Management, Experience",I haven't used Auth0 before.,"Beginner: I have used Auth0 for basic tasks, such as user authentication and basic authorization.","Intermediate: I've regularly used Auth0, including managing user identities, implementing role-based access control, and handling basic troubleshooting.","Advanced: I have extensive experience with Auth0, including managing large user bases, implementing advanced access control strategies, integrating with other systems, and ensuring compliance with identity management regulations.",,,,,
109,Tools & Platforms,How familiar are you with Tealium for customer data management and event tracking?,TRUE,"Tealium, Customer Data Management, Event Tracking, Familiarity",I haven't used Tealium before.,"Beginner: I have used Tealium for basic tasks, such as tracking user events and managing basic customer data.","Intermediate: I've regularly used Tealium, including setting up and managing complex event tracking, managing customer data, and generating basic reports.","Advanced: I have extensive experience with Tealium, including managing large-scale customer data, setting up advanced event tracking strategies, integrating with other systems for data analysis, and ensuring compliance with data management regulations.",,,,,
110,Tools & Platforms,How comfortable are you with Azure Active Directory for identity and access management?,TRUE,"Azure Active Directory, Identity and Access Management, Comfort Level",I haven't used Azure Active Directory before.,"Beginner: I have used Azure Active Directory for basic tasks, such as user creation and managing basic access controls.","Intermediate: I've regularly used Azure Active Directory, including managing users and groups, implementing role-based access control, and handling troubleshooting.","Advanced: I have extensive experience with Azure Active Directory, including managing large user bases, implementing advanced access control strategies, integrating with other systems, and ensuring compliance with identity management regulations.",,,,,
