QuestionID,Domain Tags,Question,Manually Reviewed,Search Tags,Answer (1),Answer (2),Answer (3),Answer (4),Employer Question Phrasing,Employer Answer 1,Employer Answer 2,Employer Answer 3,Employer Answer 4
1,Industry Certifications,Are you a Cisco Certified Internetwork Expert (CCIE)?,TRUE,"CCIE, Cisco, Certification",Yes ,No ,,,,,,,
2,Industry Certifications,Have you obtained the AWS Certified Solutions Architect - Associate certificate?,TRUE,"AWS, Certification, Solutions Architect",Yes ,No ,,,,,,,
3,Industry Certifications,Are you a Certified Information Systems Security Professional (CISSP)?,TRUE,"CISSP, Certification, Information Security",Yes ,No ,,,,,,,
4,Industry Certifications,Do you hold a VMware Certified Professional – Network Virtualization (VCP-NV) certification?,TRUE,"VCP-NV, VMware, Network Virtualization",Yes ,No ,,,,,,,
5,Industry Certifications,Have you obtained AWS's Certified Solutions Architect (CSA) certification?,TRUE,"CSA, AWS, Certification",Yes ,No ,,,,,,,
6,Industry Certifications,Are you Google Cloud Certified as a Professional Cloud Architect?,TRUE,"Google Cloud, Certification, Cloud Architect",Yes ,No ,,,,,,,
7,Industry Certifications,Have you achieved Microsoft's Azure Solutions Architect Expert certification?,TRUE,"Azure, Microsoft, Certification, Solutions Architect",Yes ,No ,,,,,,,
8,Industry Certifications,Do you hold the Certified Ethical Hacker (CEH) certification?,TRUE,"CEH, Ethical Hacking, Certification",Yes ,No ,,,,,,,
9,Industry Certifications,Do you hold The Open Group Architecture Foundation (TOGAF) certification?,TRUE,"TOGAF, Certification, Architecture Framework",Yes ,No ,,,,,,,
10,Industry Certifications,Do you hold the Certified Information Systems Auditor (CISA) certification?,TRUE,"CISA, Information Systems Auditor, Certification",Yes ,No ,,,,,,,
11,Industry Certifications,Are you a Certified ScrumMaster (CSM)?,TRUE,"CSM, ScrumMaster, Agile, Certification",Yes ,No ,,,,,,,
12,Industry Certifications,Have you obtained the ITIL certification?,TRUE,"ITIL, Certification, IT Service Management",Yes ,No ,,,,,,,
13,Industry Certifications,Do you hold the Project Management Professional (PMP) certification?,TRUE,"PMP, Project Management, Certification",Yes ,No ,,,,,,,
14,Industry Certifications,Are you a certified Salesforce Administrator?,TRUE,"Salesforce, Administrator, Certification",Yes ,No ,,,,,,,
15,Industry Certifications,"Have you achieved the Oracle Certified Professional, Java SE 8 Programmer certification?",TRUE,"Oracle, Java, Certification, Programmer",Yes ,No ,,,,,,,
16,Industry Certifications,Are you a Cisco Certified Network Associate (CCNA)?,TRUE,"CCNA, Cisco, Certification",Yes ,No ,,,,,,,
17,Industry Certifications,Do you hold the CompTIA Security+ certification?,TRUE,"CompTIA, Security, Certification",Yes ,No ,,,,,,,
18,Industry Certifications,Are you a Certified Network Defense Architect (CNDA)?,TRUE,"CNDA, Network Defense, Certification",Yes ,No ,,,,,,,
19,Industry Certifications,Do you have a Certified Information Security Manager (CISM) certification?,TRUE,"CISM, Information Security, Certification",Yes ,No ,,,,,,,
20,Industry Certifications,Are you Certified in Risk and Information Systems Control (CRISC)?,TRUE,"CRISC, Risk, Information Systems Control, Certification",Yes ,No ,,,,,,,
21,Industry Certifications,Do you hold a Certified Cloud Security Professional (CCSP) certification?,TRUE,"CCSP, Cloud Security, Certification",Yes ,No ,,,,,,,
22,Industry Certifications,Are you a Systems Security Certified Practitioner (SSCP)?,TRUE,"SSCP, Systems Security, Certification",Yes ,No ,,,,,,,
23,Industry Certifications,Do you hold an Offensive Security Certified Professional (OSCP) certification?,TRUE,Are you Certified in the Governance of Enterprise IT (CGEIT)?,Yes ,No ,,,,,,,
24,Industry Certifications,Are you Certified in the Governance of Enterprise IT (CGEIT)?,TRUE,"CGEIT, IT Governance, Certification",Yes ,No ,,,,,,,
25,Industry Certifications,Have you achieved the ITIL certification?,TRUE,"ITIL, Certification, IT Service Management",Yes ,No ,,,,,,,
26,Industry Certifications,Are you a Google Certified Professional – Cloud Network Engineer?,TRUE,"Google Cloud, Network Engineer, Certification",Yes ,No ,,,,,,,
27,Industry Certifications,Are you a Certified Wireless Network Professional (CWNP)?,TRUE,"CWNP, Wireless Network, Certification",Yes ,No ,,,,,,,
28,Technical Knowledge,Rate your proficiency in Python based on your project experience.,TRUE,"Python, Programming, Language, Coding",No experience,Beginner: Familiarity with basic Python syntax and structures from limited project experience or coursework.,"Intermediate: Regular use of Python in multiple projects, including comfort with advanced syntax, error handling, and data structures.","Advanced: Extensive experience with Python in complex projects, demonstrating deep understanding of libraries, frameworks, and performance optimization.",,,,,
29,Technical Knowledge,Rate your ability to design and implement RESTful APIs.,FALSE,"RESTful, APIs, Web Services, Design, Implementation",No experience,"Beginner: Familiar with the concept of RESTful APIs, with limited hands-on design and implementation experience.","Intermediate: Regularly design and implement RESTful APIs, with a solid understanding of best practices and protocols.","Advanced: Extensive experience designing and implementing RESTful APIs, with deep knowledge of optimization and advanced features.",,,,,
30,Technical Knowledge,Describe your proficiency in data modeling and database design.,TRUE,"Data Modeling, Database Design, Database",No experience,"Beginner: Familiar with basic data modeling concepts and database design, possibly from coursework or limited hands-on experience.","Intermediate: Regular use of data modeling and database design in projects, with a good understanding of relational and/or non-relational database systems.","Advanced: Extensive experience with data modeling and database design, including proficiency in normalization, indexing, and performance optimization techniques.",,,,,
31,Technical Knowledge,How familiar are you with microservices architecture?,TRUE,"Microservices, Architecture, System Design",No experience,"Beginner: Aware of microservices architecture principles, with little to no hands-on experience in a project setting.","Intermediate: Have worked on projects involving microservices architecture, with an understanding of related technologies like Docker and Kubernetes.","Advanced: Extensive experience designing and implementing microservices architectures, with deep knowledge of best practices, patterns, and inter-service communication.",,,,,
32,Technical Knowledge,"Rate your proficiency with DevOps practices (CI/CD, Docker, Jenkins).",TRUE,"DevOps, CI/CD, Docker, Jenkins",No experience,"Beginner: Understand the concept of DevOps, and have used tools like Docker and Jenkins at a basic level.","Intermediate: Regular involvement in implementing DevOps practices, including building CI/CD pipelines, containerization, and orchestration.","Advanced: Significant experience with DevOps practices, including automation, infrastructure as code (IaC), and monitoring and troubleshooting in a live environment.",,,,,
33,Technical Knowledge,"Rate your expertise in cloud platforms (AWS, Azure, Google Cloud Platform).",TRUE,"Cloud Platforms, AWS, Azure, Google Cloud",No experience,"Beginner: Aware of cloud concepts, have used one or more cloud platforms on a basic level or for learning purposes.","Regularly use cloud platforms in a professional context, familiar with deploying and managing applications or services.","Advanced: Deep knowledge of multiple cloud platforms, proficient in managing large-scale applications, services, and cloud infrastructure.",,,,,
34,Technical Knowledge,"Rate your proficiency with front-end development technologies (HTML, CSS, JavaScript, React).",TRUE,"Front-End Development, HTML, CSS, JavaScript, React",No experience,"Beginner: Understand the basics of HTML, CSS, and JavaScript, and have used them in simple web projects or coursework.","Intermediate: Regular use of front-end technologies in professional work, familiar with a front-end framework/library like React.","Advanced: Expertise in modern front-end development, including building complex web applications using JavaScript frameworks like React.",,,,,
35,Technical Knowledge,Describe your proficiency using Machine Learning algorithms for predictive modeling.,TRUE,"Machine Learning, Algorithms, Predictive Modeling",No experience,"Beginner: Familiar with basic machine learning concepts, have used algorithms in a learning or academic context.","Intermediate: Regular use of machine learning algorithms for predictive modeling in professional projects, with experience in model selection and evaluation.","Advanced: Deep knowledge of machine learning, experienced in feature engineering, model optimization, and deploying ML models",,,,,
36,Technical Knowledge,"Describe your experience with version control systems, particularly Git.",TRUE,"Version Control, Git",No experience,"Beginner: Familiar with basic version control concepts, have used Git for simple projects or coursework.","Intermediate: Regular use of Git in professional context, proficient with branching, merging, and resolving conflicts.","Advanced: Mastery of Git, comfortable with advanced operations such as rebase, cherry-pick, bisect, and can administer a Git server.",,,,,
37,Technical Knowledge,Rate your understanding of data security and encryption protocols.,TRUE,"Data Security, Encryption, Protocols",No experience,"Beginner: Basic understanding of data security concepts and encryption protocols, but limited hands-on experience.","Intermediate: Regularly work with data security and encryption protocols in a professional setting, knowledgeable about implementing secure communication.","Advanced: Deep understanding of various encryption protocols, hands-on experience with securing large-scale applications or infrastructure.",,,,,
38,Technical Knowledge,Rate your proficiency with CRM platforms like Salesforce or Microsoft Dynamics 365.,TRUE,"CRM, Salesforce, Microsoft Dynamics 365",No experience,"Beginner: Basic understanding of CRM concepts, have used platforms like Salesforce or Dynamics 365 for learning or basic tasks.","Intermediate: Regularly use a CRM platform in professional work, experienced with managing contacts, leads, and opportunities.","Advanced: Expertise with CRM platforms, capable of customizing and integrating the platform according to business needs.",,,,,
39,Technical Knowledge,Rate your proficiency managing and analyzing customer data for sales and marketing purposes.,TRUE,"Customer Data, Sales, Marketing, Data Analysis",No experience,"Beginner: Basic understanding of sales and marketing data, used analytics tools for rudimentary data management and analysis.","Intermediate: Regularly manage and analyze customer data for sales and marketing, proficient in using advanced analytics tools.","Advanced: Expertise in managing large datasets, able to derive actionable insights for sales and marketing strategies.",,,,,
40,Technical Knowledge,How familiar are you with the concepts and processes of data integration?,TRUE,"Data Integration, Concepts, Processes",No experience,"Beginner: Basic understanding of data integration concepts and processes, have used integration tools or platforms for learning purposes.","Intermediate: Regularly perform data integration tasks in professional setting, able to handle diverse data sources and formats.","Advanced: Deep knowledge of data integration, experienced with designing and implementing large-scale data integration solutions.",,,,,
41,Technical Knowledge,Describe your proficiency developing and executing email marketing campaigns.,TRUE,"Email Marketing, Campaigns",No experience,"Beginner: Basic understanding of email marketing, have used email marketing tools for learning or simple campaigns.","Intermediate: Regularly execute email marketing campaigns, capable of segmenting audiences and analyzing results.","Advanced: Deep understanding of email marketing, able to strategize and execute complex campaigns for maximum conversion.",,,,,
42,Technical Knowledge,Rate your proficiency in project management methodologies like Agile or Waterfall.,TRUE,"Project Management, Agile, Waterfall",No experience,"Beginner: Basic understanding of Agile or Waterfall methodologies, have participated in projects using these methodologies.","Intermediate: Regularly use Agile or Waterfall methodologies in professional setting, able to manage project stages effectively.","Advanced: Deep expertise in Agile or Waterfall, able to manage complex projects and train others in these methodologies.",,,,,
43,Technical Knowledge,Rate your expertise in network architecture and communication protocols.,TRUE,"Network Architecture, Communication Protocols",No experience,"Basic understanding of network architecture and communication protocols, have configured networks or used protocols for learning.","Intermediate: Regularly work with network architecture and communication protocols, able to troubleshoot network issues.","Advanced: Deep knowledge in network architecture and communication protocols, able to design and implement complex networks.",,,,,
44,Technical Knowledge,Rate your understanding of cybersecurity principles.,TRUE,"Cybersecurity, Principles",No experience,"Beginner: Basic understanding of cybersecurity principles, have followed best practices for security.","Intermediate: Regularly deal with cybersecurity-related tasks, capable of identifying potential vulnerabilities.","Advanced: Expert in cybersecurity principles, capable of developing and implementing security policies.",,,,,
45,Technical Knowledge,How proficient are you in designing product configuration strategies?,TRUE,"Product Configuration, Design Strategies, Proficiency Level",No experience,"Beginner: Basic understanding of product configuration strategies, have participated in product design or configuration.","Intermediate: Regularly work with product configuration strategies, capable of designing product configurations for simple products.","Advanced: Comprehensive understanding of product configuration strategies, including scalability and optimization",,,,,
46,Technical Knowledge,Rate your familiarity with cloud computing platforms.,TRUE,"Cloud Computing, Familiarity, Proficiency Level",No experience,"Beginner: Basic understanding of cloud computing, have used cloud platforms like AWS, Azure or GCP.","Intermediate: Regular experience with cloud computing platforms, able to manage resources and services.","Advanced: Extensive experience with cloud computing platforms, able to architect and deploy complex applications.",,,,,
47,Technical Knowledge,How proficient are you in cybersecurity best practices?,TRUE,"Cybersecurity, Best Practices, Proficiency Level",No experience,"Beginner: Basic understanding of cybersecurity best practices, have followed them in personal or professional projects.","Intermediate: Regularly apply cybersecurity best practices, capable of identifying potential security issues.","Advanced: Deep knowledge of cybersecurity best practices, can guide teams or organizations in adhering to them.",,,,,
48,Technical Knowledge,Rate your understanding of network architecture and infrastructure.,TRUE,"Network Architecture, Infrastructure, Understanding Level",No experience,"Beginner: Basic understanding of network architecture and infrastructure, familiar with terms like IP, DNS, VPN.","Intermediate: Comfortable with designing and maintaining a network, experience with network troubleshooting.","Advanced: Deep knowledge of network architecture, able to design, implement, and manage complex network infrastructure.",,,,,
49,Technical Knowledge,How proficient are you in interpreting and utilizing data analytics?,TRUE,"Data Analytics, Interpretation, Utilization, Proficiency Level",No experience,"Beginner: Basic understanding of data analytics concepts, familiarity with data visualization tools.","Intermediate: Regularly interpret data to derive insights, capable of using analytics tools like Google Analytics, Tableau.","Advanced: Extensive experience in data analytics, able to develop and execute data-driven strategies.",,,,,
50,Technical Knowledge,Rate your understanding of Machine Learning and Artificial Intelligence concepts.,TRUE,"Machine Learning, Artificial Intelligence, Understanding Level",No experience,"Beginner: Basic understanding of ML and AI concepts, familiar with common algorithms and frameworks.","Intermediate: Regular experience applying ML and AI principles, able to develop basic predictive models.","Advanced: Deep knowledge of ML and AI, capable of designing and implementing complex ML models.",,,,,
51,Technical Knowledge,How proficient are you with SQL or other database querying languages?,TRUE,"SQL, Database Querying, Language Proficiency",No experience,"Beginner: Basic understanding of SQL or similar languages, can write simple queries.","Intermediate: Comfortable with SQL, able to create, manipulate, and manage databases.","Advanced: Extensive experience with SQL, capable of optimizing queries and managing complex database systems.",,,,,
52,Technical Knowledge,How well do you understand software testing methodologies?,TRUE,"Software Testing, Methodologies, Understanding Level",No experience,"Beginner: Basic understanding of software testing concepts and methodologies, such as unit testing and integration testing.","Intermediate: Regular involvement in software testing, able to design and implement test cases and scripts.","Advanced: Extensive experience in software testing, capable of leading testing strategies and methodologies.",,,,,
53,Technical Knowledge,How comfortable are you with integrating different software systems using APIs?,TRUE,"Software Integration, APIs, Comfort Level",No experience,Beginner: Basic understanding of APIs and their uses in software integration.,"Intermediate: Regularly use APIs for software integration, able to design basic APIs.","Advanced: Extensive experience in API design and implementation, capable of managing complex system integrations.",,,,,
54,Technical Knowledge,Rate your knowledge in cryptography and its application in data security.,TRUE,"Cryptography, Data Security, Application, Knowledge Level",No experience,Beginner: Basic understanding of cryptographic principles and common algorithms used in data security,"Intermediate: Regular use of cryptographic techniques, able to apply encryption and decryption for data security.","Advanced: Extensive experience in cryptography, capable of designing and implementing secure systems using advanced cryptographic techniques.",,,,,
55,Technical Knowledge,How familiar are you with distributed systems architecture?,TRUE,"Distributed Systems, Architecture, Familiarity Level",No experience,"Beginner: Basic understanding of distributed systems, familiar with concepts like horizontal scaling and fault tolerance.","Intermediate: Regular work with distributed systems, capable of designing simple distributed architectures.","Advanced: Extensive experience in distributed systems, able to design and implement complex distributed architectures for high scalability and performance.",,,,,
56,Technical Knowledge,How well do you understand data warehousing?,TRUE,"Data Warehousing, Understanding Level",No experience,"Beginner: Basic understanding of data warehousing concepts, familiar with concepts like ETL (Extract, Transform, Load) and OLAP (Online Analytical Processing).","Intermediate: Regular involvement in data warehousing projects, capable of designing and managing simple data warehouses.","Advanced: Extensive experience in data warehousing, able to design, implement, and manage complex data warehouses with large data volumes.",,,,,
57,Technical Knowledge,How well do you understand Internet of Things (IoT) protocols and technologies?,TRUE,"IoT, Protocols, Technologies, Understanding Level",No experience,"Beginner: Basic knowledge of IoT concepts and some common protocols like MQTT, CoAP.","Intermediate: Practical experience with IoT devices and platforms, capable of developing simple IoT applications.","Advanced: Extensive experience with IoT, able to design, implement, and manage complex IoT systems using various protocols and technologies.",,,,,
58,Technical Knowledge,Rate your knowledge of DevOps methodologies and practices.,TRUE,"DevOps, Methodologies, Practices, Knowledge Level",No experience,"Beginner: Basic understanding of DevOps concepts, principles, and tools such as Jenkins, Docker, Kubernetes.","Intermediate: Regular involvement in a DevOps environment, capable of setting up simple CI/CD pipelines.","Advanced: Extensive experience in a DevOps role, able to design, implement, and manage complex DevOps pipelines and practices.",,,,,
59,Technical Knowledge,How familiar are you with machine learning algorithms?,TRUE,"Machine Learning, Algorithms, Familiarity Level",No experience,Beginner: Basic understanding of machine learning concepts and some common algorithms.,"Intermediate: Practical experience with machine learning tools and libraries, capable of developing simple predictive models.","Advanced: Extensive experience with machine learning, able to design, train, and evaluate complex machine learning models.",,,,,
60,Technical Knowledge,"Rate your comfort level with web development languages (HTML, CSS, JavaScript).",TRUE,"Web Development, HTML, CSS, JavaScript, Comfort Level",No experience,"Beginner: Basic understanding and use of HTML, CSS, JavaScript, able to build simple web pages.","Intermediate: Regularly codes in these languages, able to design and implement interactive websites.","Advanced: Extensive experience with web development, proficient in latest standards, able to optimize performance and usability.",,,,,
61,Technical Knowledge,How proficient are you in managing and interpreting large datasets?,TRUE,"Large Datasets, Management, Interpretation, Proficiency Level",No experience,"Beginner: Basic understanding of data management principles, able to perform simple data analysis.","Intermediate: Experience in handling sizable datasets, proficient in data cleaning, transformation, and basic statistical analysis.","Advanced: Extensive experience in data management and analysis, able to design and implement complex data pipelines, proficient in advanced statistical methods.",,,,,
62,Technical Knowledge,Describe your experience with disaster recovery planning and strategies in a professional setting.,TRUE,"Disaster Recovery, Planning, Strategies, Professional Experience",No experience,Beginner: Basic understanding of disaster recovery concepts and best practices.,Intermediate: Practical experience in creating and executing disaster recovery plans in a professional setting.,"Advanced: Extensive experience in disaster recovery planning and implementation, able to design, test, and optimize complex disaster recovery strategies.",,,,,
63,Technical Knowledge,Rate your comfort level with implementing or managing identity and access management,TRUE,"IAM, Implementation, Management, Comfort Level",No experience,"Beginner: Familiar with the concept of IAM, able to manage basic user and group permissions.","ntermediate: Experience in implementing and managing IAM in a professional setting, able to set up roles, policies, and permissions.","Advanced: Extensive experience in IAM, proficient in designing and implementing complex IAM strategies, experienced in working with various IAM platforms and tools.",,,,,
64,Technical Knowledge,How well do you understand real-time data processing and analytics?,TRUE,"Real-Time Data, Processing, Analytics, Understanding Level",No experience,"Beginner: Understands the concept of real-time data processing and analytics, able to perform simple real-time data analysis.","Intermediate: Has experience in implementing real-time data processing and analytics in a professional setting, familiar with tools and platforms for real-time analytics.","Advanced: Extensive experience in real-time data processing, able to design and implement complex real-time analytics solutions.",,,,,
65,Technical Knowledge,Rate your understanding of load balancing strategies and techniques,TRUE,"Load Balancing, Strategies, Techniques, Understanding Level",No experience,"Beginner: Familiar with the concept of load balancing, understands its importance in managing network traffic.","Intermediate: Experience in implementing load balancing in a professional setting, able to set up and configure load balancers.","Advanced: Extensive experience in designing and implementing load balancing strategies, proficient in various load balancing techniques and technologies.",,,,,
66,Technical Knowledge,How well do you understand machine learning algorithms and their implementation?,TRUE,"Machine Learning, Algorithms, Implementation, Understanding Level",No experience,"Beginner: Familiar with the concept of machine learning, understands basic algorithms and their applications.","Intermediate: Experience in implementing machine learning algorithms in a professional setting, able to design simple machine learning models.","Advanced: Extensive experience in designing and implementing complex machine learning models, proficient in a variety of machine learning algorithms and tools.",,,,,
